{
  "chapter_id": "ch03",
  "chapter_title": "能最快找到想做的事的公式：自我认知法",
  "md_source": "chapter_md/第三章-能最快找到想做的事的公式：自我认知法.md",
  "core_concepts": [
    "真正想做的事 = 喜欢 × 擅长 × 重要（三者的交集）",
    "喜欢：能让你沉浸、忘记时间的领域或活动",
    "擅长：天生才能（talent）与后天技能 / 知识（skill）的结合",
    "重要：由价值观驱动、对你或他人真正有意义的事",
    "自我认知法三步：先分别看清喜欢、擅长、重要，再找交集"
  ],
  "guiding_questions": [
    "你做哪件事时会忘记时间、做完还意犹未尽？",
    "别人常常夸你、或遇事爱向你请教的是哪方面？",
    "有什么事让你觉得『就算没人要求，我也想做』？",
    "如果删掉所有『应该做』的事，剩下你真正在乎的是什么？"
  ],
  "exercises": [
    {
      "name": "三圆交集练习",
      "instruction": "画三个相交圆，分别写下『喜欢』『擅长』『重要』的具体事项，标出三者重叠区。",
      "worksheet": "喜欢：[...] / 擅长：[...] / 重要：[...] / 交集：[...]"
    }
  ],
  "output_template": "请输出：①你的三圆清单（各 3–5 项）②将交集区总结为一句话『我真正想做的事是……』。",
  "few_shot_examples": [
    {
      "user": "我好像什么都不擅长。",
      "assistant": "先别急着下结论。我们换个角度：回想一下，别人常在什么事情上找你帮忙或夸你？哪怕是『很会安慰人』『总能找到好吃的店』这种小事，也藏着你的天赋。先从这里开始列一列？"
    }
  ]
}
