{
  "chapter_id": "ch01",
  "chapter_title": "阻碍找到想做的事的5种误区",
  "md_source": "chapter_md/第一章-阻碍找到_想做的事_的5种误区.md",
  "core_concepts": [
    "找不到想做的事，往往不是能力问题，而是被『误区』困住",
    "五大误区：①必须是能坚持一生的事 ②找到想做的事时会有命中注定的感觉 ③必须是对别人有益的事 ④必须多行动才能找到 ⑤想做的事不能成为工作",
    "误区的本质是用『外部标准』替代了自我认知"
  ],
  "guiding_questions": [
    "你是否把“必须是能坚持一生的事”当成寻找想做的事的前提？",
    "你是否在等待“找到想做的事时会有命中注定的感觉”，才相信自己找到了想做的事？",
    "你是否把“必须是对别人有益的事”当成判断标准，压低了自己的兴趣？"
  ],
  "exercises": [
    {
      "step_id": "step-1",
      "name": "误区自检清单",
      "instruction": "对照五大误区，标记自己中了几条，并写下每条背后那个『外部声音』。",
      "worksheet": "误区1–5：中/不中 + 我当时怎么想",
      "user_action": "用户勾选自己中招的误区条目（书里表1-1 的 5 个误区），并自由写下每条背后的外部声音来源。LLM 不替用户判断是否『真中招』——这是用户自评。",
      "llm_role": "assist",
      "step_role_id": "career_counselor",
      "output_fields": [
        {
          "name": "misconceptions_cleared",
          "type": "editable_list",
          "lockable": true
        },
        {
          "name": "external_voices",
          "type": "markdown"
        },
        {
          "name": "commentary",
          "type": "markdown"
        }
      ],
      "few_shot_examples": [
        {
          "user": "必须是对别人有益的事",
          "assistant": "{\"commentary\": \"### 误区 3：必须是对别人有益的事\\n\\n必须是对别人有益的事\\n\\n为自己而活也是在帮助别人\", \"misconceptions_cleared\": [\"3. 必须是对别人有益的事\"], \"external_voices\": {}}"
        }
      ],
      "input_schema": [
        {
          "type": "checklist",
          "name": "misconceptions",
          "items": [
            {
              "id": "1",
              "label": "必须是能坚持一生的事",
              "wrong": "必须是能坚持一生的事",
              "right": "做“现在最想做的事”就可以了"
            },
            {
              "id": "2",
              "label": "找到想做的事时会有命中注定的感觉",
              "wrong": "找到想做的事时会有命中注定的感觉",
              "right": "即使找到了想做的事，一开始也只是处在感兴趣的阶段"
            },
            {
              "id": "3",
              "label": "必须是对别人有益的事",
              "wrong": "必须是对别人有益的事",
              "right": "为自己而活也是在帮助别人"
            },
            {
              "id": "4",
              "label": "必须多行动才能找到",
              "wrong": "必须多行动才能找到",
              "right": "了解自己才能找到想做的事"
            },
            {
              "id": "5",
              "label": "想做的事不能成为工作",
              "wrong": "想做的事不能成为工作",
              "right": "想做的事在自己心中，实现手段在社会中"
            }
          ],
          "followup": {
            "name": "external_voice",
            "type": "text",
            "show_when": "checked",
            "placeholder": "写下这条误区背后的外部声音",
            "required": false
          },
          "explain": {
            "title": "什么是“外部声音”？",
            "body": "外部声音 = 来自他人期待 / 社会标准 / 薪资排名 / 热门行业等，不是你自己真正想要的。",
            "examples": [
              "“我爸爸总说选错行一辈子完了”",
              "“同事都在跳槽我也得跳”"
            ]
          }
        }
      ]
    }
  ],
  "output_template": "请严格输出一个 JSON 对象，字段为 commentary、misconceptions_cleared、external_voices。commentary 必须基于本章正文，但不是本章摘要，必须只围绕用户本次填写的内容展开：对 misconceptions.checked_ids 中的每一个编号分别建立一段解释；先结合该编号对应的 external_voices 原话或用户填写的想法，说明它如何让用户卡住，再用自己的话解释本章对应的正确认知和一个可继续观察的方向。不得只复述用户输入，不得编造未填写的外部声音，不得替用户判断是否真的中招。misconceptions_cleared 必须只列出用户勾选的误区编号与名称；external_voices 必须按误区编号保留用户填写的原文。",
  "few_shot_examples": [
    {
      "user": "必须是对别人有益的事",
      "assistant": "{\"commentary\": \"### 误区 3：必须是对别人有益的事\\n\\n必须是对别人有益的事\\n\\n为自己而活也是在帮助别人\", \"misconceptions_cleared\": [\"3. 必须是对别人有益的事\"], \"external_voices\": {}}"
    }
  ],
  "mentor_hooks": {
    "focus": "解构『想做的事』的常见误解，确认起点",
    "references": []
  }
}
