{
  "chapter_id": "ch03",
  "chapter_title": "能最快找到想做的事的公式：自我认知法",
  "md_source": "chapter_md/第三章-能最快找到想做的事的公式：自我认知法.md",
  "core_concepts": [
    "真正想做的事 = 喜欢 × 擅长 × 重要（三者的交集）",
    "喜欢：能让你沉浸、忘记时间的领域或活动",
    "擅长：天生才能（talent），≠ 后天习得的技能/知识（skill）",
    "重要：由价值观驱动、对你或他人真正有意义的事",
    "自我认知法三步：先分别看清喜欢、擅长、重要，再找交集"
  ],
  "guiding_questions": [
    "你做哪件事时会忘记时间、做完还意犹未尽？",
    "别人常常夸你、或遇事爱向你请教的是哪方面？",
    "有什么事让你觉得『就算没人要求，我也想做』？",
    "如果删掉所有『应该做』的事，剩下你真正在乎的是什么？"
  ],
  "exercises": [
    {
      "name": "三圆交集练习",
      "instruction": "分别写下『重要』『擅长』『喜欢』的具体事项（三圆为陈列展示，非几何求交），由 LLM 在阶段2 给出交集结论。",
      "worksheet": "重要：[...] / 擅长：[...] / 喜欢：[...] / 交集（AI 给）：[...]",
      "user_action": "用户分别输入三类各 3–5 项。LLM 不判对错，而是辅助纠正混淆、引导拆解、取交集。",
      "llm_role": "assist",
      "input_schema": [
        {
          "name": "importance",
          "label": "重要的事",
          "type": "list_of_items",
          "required": true,
          "min_items": 3,
          "max_items": 5,
          "item_schema": {
            "fields": [
              {
                "name": "text",
                "type": "text",
                "label": "写下一项你想怎样生活或帮助他人的方向"
              }
            ]
          }
        },
        {
          "name": "talents",
          "label": "擅长的事",
          "type": "list_of_items",
          "required": true,
          "min_items": 3,
          "max_items": 5,
          "item_schema": {
            "fields": [
              {
                "name": "text",
                "type": "text",
                "label": "写下一项不太费力就能做好的事"
              }
            ]
          }
        },
        {
          "name": "likes",
          "label": "喜欢的事",
          "type": "list_of_items",
          "required": true,
          "min_items": 3,
          "max_items": 5,
          "item_schema": {
            "fields": [
              {
                "name": "text",
                "type": "text",
                "label": "写下一项喜欢的领域或活动"
              }
            ]
          }
        }
      ],
      "output_fields": [
        {
          "name": "commentary",
          "type": "markdown",
          "readonly": true
        },
        {
          "name": "importance",
          "type": "editable_list",
          "lockable": true
        },
        {
          "name": "talents",
          "type": "editable_list",
          "lockable": true
        },
        {
          "name": "likes",
          "type": "editable_list",
          "lockable": true
        },
        {
          "name": "intersection",
          "type": "text",
          "readonly": true
        }
      ],
      "few_shot_examples": [
        {
          "user": "喜欢：打游戏、看电影。擅长：写代码、英语。重要：家人健康、帮助别人。交集？好像没有。",
          "assistant": "先别急。『写代码』是技能知识，不是天生才能——你天生比别人『不痛苦就能做很久』的是什么？『打游戏』你喜欢的是策略还是和朋友的协作？把『擅长』换成才能、把『喜欢』拆成领域，再看交集。比如『帮别人 + 表达/协作 + 一点代码』会不会是『做帮人提效的小工具』？"
        }
      ],
      "step_id": "step-1",
      "step_role_id": "psychologist"
    }
  ],
  "output_template": "请严格输出 JSON，字段必须包含：commentary、importance、talents、likes、intersection。commentary 必须结合用户三组原始输入和本章正文，逐条指出混淆（例如把技能当成才能、把职业名当成喜欢），给出重分类或拆解建议；不得只复述输入，也不是本章摘要。likes、talents、importance 是归一化后的三要素清单；intersection 是基于三者交集的一句话总结。",
  "few_shot_examples": [
    {
      "user": "我好像什么都不擅长。",
      "assistant": "先别急着下结论。我们换个角度：回想一下，别人常在什么事情上找你帮忙或夸你？哪怕是『很会安慰人』『总能找到好吃的店』这种小事，也藏着你的天赋。先从这里开始列一列？"
    }
  ],
  "step_context": {
    "references": []
  },
  "ui_context": {
    "references": ["external_voices"]
  },
  "mentor_hooks": {
    "focus": "建立『喜欢 × 擅长 × 重要』框架",
    "references": [
      "misconceptions_cleared",
      "external_voices"
    ]
  }
}
