{
  "chapter_id": "ch08",
  "chapter_title": "施展自我认知的魔法，使人生发生翻天覆地的变化",
  "md_source": "chapter_md/第八章-施展自我认知的魔法，使人生发生翻天覆地的变化.md",
  "core_concepts": [
    "自我认知不是终点，是『每天用』的生活方式（色彩浴：主动看见相关事物）",
    "用『海胆比喻』：中心是自我，刺是向外探索的触角",
    "全书流程：误区→迷茫→公式→重要/擅长/喜欢→真正想做→实践",
    "魔法在于：持续按内部标准做选择，人生逐步转向"
  ],
  "guiding_questions": [
    "这周你能做一个『按内部标准』的小决定吗？",
    "你愿意每天用『色彩浴』留意和想做的事相关的信号吗？",
    "如果旧环境不支持，你能先守住哪一处自主权？"
  ],
  "exercises": [
    {
      "name": "一周色彩浴",
      "instruction": "连续 7 天，每天记录 1 则与『想做的事』相关的巧合/灵感/机会。",
      "worksheet": "日期/信号/它指向什么/我做了什么",
      "user_action": "用户连续 7 天记录信号；LLM 不监督，只在周末帮归纳规律、提炼一句持续做的事（成功宣言雏形）。",
      "llm_role": "assist",
      "output_fields": [
        {
          "name": "success_statement",
          "type": "text",
          "lockable": true
        },
        {
          "name": "color_bath_log",
          "type": "table"
        }
      ],
      "few_shot_examples": [
        {
          "user": "周一刷到个播客讲『用写作梳理思路』，周二朋友突然问我能不能帮她改简历，周三我自己莫名想写点东西。",
          "assistant": "三天出现了同一个信号：『通过文字帮人理清』。这和你 ch7 的『在对话里帮人』是同一条线。周末我们再看看剩下几天，如果规律成立，你的成功宣言可能是『用文字和对话，帮人找到自己的方向』。先记着，别急着定性。"
        }
      ],
      "step_id": "step-1",
      "step_role_id": "career_counselor"
    }
  ],
  "output_template": "请输出：①你的一周色彩浴记录 ②一句『接下来持续做的事』。",
  "few_shot_examples": [
    {
      "user": "道理都懂，但回到日常又忘了。",
      "assistant": "正常。『色彩浴』就是治这个的——不用大改变，每天留意一个和想做的事有关的信号就行。这周先试：每天记一条，周末我们看看规律？"
    }
  ],
  "mentor_hooks": {
    "focus": "成功宣言 + 日常实践（色彩浴）",
    "references": [
      "values",
      "work_purpose",
      "talents",
      "likes"
    ]
  }
}