{
  "chapter_id": "ch07",
  "chapter_title": "找到真正想做的事，活出真实的自己",
  "md_source": "chapter_md/第七章-找到_真正想做的事_，活出真实的自己.md",
  "core_concepts": [
    "真正想做的事 = 喜欢 × 擅长 × 重要 的交集（组合矩阵）",
    "不是一次找到，而是螺旋迭代：先做一个，再调整",
    "用『工作目的过滤器』筛选组合，去掉『假想做』",
    "它往往是一个『组合』，不是单一标签"
  ],
  "guiding_questions": [
    "把前三章的清单放一起，哪件事同时踩中喜欢、擅长、重要？",
    "如果还没完全重叠，哪个组合『最接近』？",
    "你愿意先做一个『70分』的版本去试吗？"
  ],
  "exercises": [
    {
      "name": "三圆组合",
      "instruction": "把前面章节的清单叠成维恩图，标出交集，再用工作目的过滤器筛掉假想做。",
      "worksheet": "喜欢[] 擅长[] 重要[] → 交集[] → 过滤后[]",
      "user_action": "用户把前章清单叠成组合、标交集、用工作目的过滤器筛；LLM 不替用户定『真正想做的事』，只帮验证、提示螺旋迭代。",
      "llm_role": "assist",
      "output_fields": [
        {
          "name": "intersection",
          "type": "editable_list",
          "lockable": true
        }
      ],
      "few_shot_examples": [
        {
          "user": "喜欢=深度对话，擅长=共情梳理，重要=帮人成长，三个圈交集是『在对话里帮人』。但我觉得这不算『真正想做的事』。",
          "assistant": "书里说真正想做的事往往是一个『组合』，不是单一标签，而且不用一次找全——螺旋迭代就好。『在对话里帮人』已经是个很扎实的组合了。你犹豫的是它『不够大』吗？先做一个 70 分的版本（比如帮一个朋友做次梳理），做着做着圈会越收越准。"
        }
      ],
      "step_id": "step-1",
      "step_role_id": "career_counselor"
    }
  ],
  "output_template": "请输出：①你的『真正想做的事』候选（1–2个组合）②下一步最小行动。",
  "few_shot_examples": [
    {
      "user": "三个圈没完全重合，我是不是还没找到？",
      "assistant": "没关系，这说的是『螺旋迭代』——不用一次完美。先抓重叠最多的那个组合，做个小版本试试，做着做着圈会越收越准。你先选一个『最接近』的？"
    }
  ],
  "mentor_hooks": {
    "focus": "三要素组合 + 螺旋上升",
    "references": [
      "work_purpose",
      "talents",
      "likes"
    ]
  }
}